{
  "spec_version": "0.1.0",
  "frame_id": "world",
  "stamp": 1732212345.0,

  "nodes": [
    {
      "submap_id": 0,
      "pose": {
        "x": 0.0,
        "y": 0.0,
        "z": 0.0,
        "qx": 0.0,
        "qy": 0.0,
        "qz": 0.0,
        "qw": 1.0
      },
      "info": [
        100,
        0,
        0,
        100,
        0,
        100
      ]
    }
  ],

  "edges": [
    {
      "from_submap_id": 0,
      "to_submap_id": 1,
      "type": "odom",
      "info": [
        50,
        0,
        0,
        50,
        0,
        50
      ]
    }
  ]
}
